[
  {
    "id": "geonames-1252484",
    "geoname_id": "1252484",
    "name": "Phuntsholing",
    "ascii_name": "Phuntsholing",
    "slug": "phuntsholing",
    "country_code": "BT",
    "admin1_code": "06",
    "admin2_code": "",
    "admin3_code": "",
    "admin4_code": "",
    "lat": "26.85164",
    "lon": "89.38837",
    "population": "27658",
    "elevation": "",
    "dem": "330",
    "timezone": "Asia/Thimphu",
    "feature_class": "P",
    "feature_code": "PPL",
    "modification_date": "2023-02-24"
  },
  {
    "id": "geonames-1252479",
    "geoname_id": "1252479",
    "name": "Punākha",
    "ascii_name": "Punakha",
    "slug": "punakha",
    "country_code": "BT",
    "admin1_code": "15",
    "admin2_code": "",
    "admin3_code": "",
    "admin4_code": "",
    "lat": "27.59137",
    "lon": "89.87743",
    "population": "21500",
    "elevation": "",
    "dem": "1293",
    "timezone": "Asia/Thimphu",
    "feature_class": "P",
    "feature_code": "PPLA",
    "modification_date": "2026-04-13"
  },
  {
    "id": "geonames-1252416",
    "geoname_id": "1252416",
    "name": "Thimphu",
    "ascii_name": "Thimphu",
    "slug": "thimphu",
    "country_code": "BT",
    "admin1_code": "20",
    "admin2_code": "",
    "admin3_code": "",
    "admin4_code": "",
    "lat": "27.46609",
    "lon": "89.64191",
    "population": "98676",
    "elevation": "2320",
    "dem": "2307",
    "timezone": "Asia/Thimphu",
    "feature_class": "P",
    "feature_code": "PPLC",
    "modification_date": "2019-09-05"
  },
  {
    "id": "geonames-1252608",
    "geoname_id": "1252608",
    "name": "Tsirang",
    "ascii_name": "Tsirang",
    "slug": "tsirang",
    "country_code": "BT",
    "admin1_code": "07",
    "admin2_code": "",
    "admin3_code": "",
    "admin4_code": "",
    "lat": "27.0219",
    "lon": "90.12291",
    "population": "22376",
    "elevation": "",
    "dem": "1410",
    "timezone": "Asia/Thimphu",
    "feature_class": "P",
    "feature_code": "PPLA",
    "modification_date": "2026-04-13"
  }
]
